{
  "$schema": "https://json-schema.org/draft/2020-12/schema",
  "$id": "urn:casebook:schema:case-import:v1",
  "title": "CaseBook case import (v1)",
  "description": "A structured document that seeds a new or existing CaseBook case with a summary, timeline entries, entities/IOCs and action items. Imported as a human-confirmed draft.",
  "type": "object",
  "additionalProperties": false,
  "required": [
    "format",
    "schemaVersion"
  ],
  "properties": {
    "format": {
      "const": "casebook-case-import"
    },
    "schemaVersion": {
      "type": "integer",
      "const": 1
    },
    "origin": {
      "type": "string",
      "description": "Provenance recorded as the source of imported indicators and timeline entries (e.g. \"AI-assisted (Copilot)\", \"manual\", \"XSIAM\")."
    },
    "target": {
      "$ref": "#/$defs/target"
    },
    "summary": {
      "type": "string",
      "description": "A narrative summary of the matter, imported as an analyst note."
    },
    "timeline": {
      "type": "array",
      "items": {
        "$ref": "#/$defs/timelineEntry"
      },
      "maxItems": 1000
    },
    "entities": {
      "type": "array",
      "items": {
        "$ref": "#/$defs/entity"
      },
      "maxItems": 2000
    },
    "actionItems": {
      "type": "array",
      "items": {
        "$ref": "#/$defs/actionItem"
      },
      "maxItems": 500
    }
  },
  "$defs": {
    "target": {
      "type": "object",
      "description": "Where the import lands: an existing case (by id) or a new one.",
      "additionalProperties": false,
      "properties": {
        "caseId": {
          "type": "string",
          "format": "uuid",
          "description": "Import into this existing case (takes precedence over newCase when visible)."
        },
        "newCase": {
          "$ref": "#/$defs/newCase"
        }
      }
    },
    "newCase": {
      "type": "object",
      "description": "Opening fields for a new case.",
      "additionalProperties": false,
      "required": [
        "title"
      ],
      "properties": {
        "title": {
          "type": "string",
          "description": "Short, specific case title."
        },
        "descriptiveName": {
          "type": "string",
          "description": "Optional short slug source; derived from the title when omitted."
        },
        "classification": {
          "type": "string",
          "enum": [
            "ComplexEvent",
            "AdverseEvent",
            "Incident",
            "Breach"
          ],
          "description": "Omit or \"ComplexEvent\" files an intake Complex Event."
        },
        "severity": {
          "type": "string",
          "enum": [
            "Informational",
            "Low",
            "Medium",
            "High",
            "Critical"
          ]
        },
        "origin": {
          "type": "string",
          "enum": [
            "InternalDetection",
            "ThirdParty"
          ]
        },
        "summary": {
          "type": "string",
          "description": "The case's own summary field (distinct from the top-level summary note)."
        },
        "detectedAtUtc": {
          "type": "string",
          "format": "date-time",
          "description": "When the matter was detected (defaults to now; not in the future)."
        },
        "occurredAtUtc": {
          "type": "string",
          "format": "date-time",
          "description": "When activity began (must not be after detection)."
        },
        "dataTypesInvolved": {
          "type": "string",
          "description": "Free-text data context (notes). Regulated data elements are recorded in the impact assessment, not here."
        },
        "impactedAssets": {
          "type": "string"
        },
        "detectionCaseId": {
          "type": "string",
          "description": "The source platform's id for the event, e.g. the XSIAM incident id (the case's detection-source back-link). Up to 100 characters."
        },
        "vendorName": {
          "type": "string",
          "description": "The vendor that disclosed it. Required when origin is ThirdParty. Up to 300 characters."
        }
      }
    },
    "timelineEntry": {
      "type": "object",
      "additionalProperties": false,
      "required": [
        "description"
      ],
      "properties": {
        "occurredAtUtc": {
          "type": "string",
          "format": "date-time",
          "description": "When it happened (defaults to now if omitted; future entries are excluded). With timePrecision Day or OnOrBefore, the date; with Window, the first date."
        },
        "timePrecision": {
          "type": "string",
          "enum": [
            "Exact",
            "Day",
            "Window",
            "OnOrBefore",
            "NotStated"
          ],
          "description": "For kind Event: how precisely the time was stated. Exact (default), Day (date only), Window (between occurredAtUtc and occurredUntilUtc), OnOrBefore (on or before occurredAtUtc's date), NotStated (no time; placed after the step before it)."
        },
        "occurredUntilUtc": {
          "type": "string",
          "format": "date-time",
          "description": "For timePrecision Window: the last date."
        },
        "kind": {
          "type": "string",
          "enum": [
            "Event",
            "Investigation"
          ]
        },
        "type": {
          "type": "string",
          "enum": [
            "Detection",
            "Analysis",
            "Containment",
            "Eradication",
            "Recovery",
            "Communication",
            "Evidence",
            "Escalation",
            "Note",
            "Other",
            "Notified",
            "ScopeConfirmed",
            "DataConfirmed",
            "Remediation",
            "RegulatoryNotification",
            "Decision"
          ]
        },
        "description": {
          "type": "string",
          "description": "What happened."
        },
        "source": {
          "type": "string",
          "description": "Optional origin of this entry (defaults to the document origin)."
        },
        "rationale": {
          "type": "string",
          "description": "For type Decision: why it was decided (required for a decision). Ignored for other types."
        },
        "optionsConsidered": {
          "type": "string",
          "description": "For type Decision: the other options considered. Optional."
        },
        "decidedBy": {
          "type": "string",
          "description": "For type Decision: who made the decision, e.g. \"Incident Commander with Legal\". Optional."
        }
      }
    },
    "entity": {
      "type": "object",
      "additionalProperties": false,
      "required": [
        "value"
      ],
      "properties": {
        "type": {
          "type": "string",
          "enum": [
            "Account",
            "Host",
            "IpAddress",
            "Domain",
            "Url",
            "FileHash",
            "FileName",
            "EmailAddress",
            "Process",
            "RegistryKey",
            "Other"
          ],
          "description": "Optional \u2014 auto-detected from the value when omitted."
        },
        "value": {
          "type": "string",
          "description": "The indicator; defanged notation (hxxp://, 1.1.1[.]1) is accepted and refanged."
        },
        "label": {
          "type": "string"
        },
        "disposition": {
          "type": "string",
          "enum": [
            "Unknown",
            "Benign",
            "Suspicious",
            "Malicious",
            "Compromised"
          ]
        },
        "description": {
          "type": "string"
        },
        "source": {
          "type": "string",
          "description": "Optional (defaults to the document origin)."
        },
        "tlp": {
          "type": "string",
          "enum": [
            "Clear",
            "Green",
            "Amber",
            "AmberStrict",
            "Red"
          ],
          "description": "Optional sharing marking (TLP 2.0); kept on the indicator and in exports."
        }
      }
    },
    "actionItem": {
      "type": "object",
      "additionalProperties": false,
      "required": [
        "title"
      ],
      "properties": {
        "title": {
          "type": "string",
          "description": "The follow-up task."
        },
        "owner": {
          "type": "string"
        },
        "dueAtUtc": {
          "type": "string",
          "format": "date-time"
        }
      }
    }
  }
}